{"base_bundle_ref":"bundle:attention-task@1","change_spec":{"affected_routes":["disputa-tarea"],"base_bundle_ref":"bundle:attention-task@1","expected_mechanism":"shorter closing reply \u00e1\u00f1","operations":[{"new_ref":"eval_suite:disputas-tarea-suite@2","op":"add","precondition_digest":"sha256:4136704fa37d584b4de65be3a56b725b41f3bbc95f59f95b6273649994d4e216","target_kind":"eval_suite","target_ref":"eval_suite:disputas-tarea-suite@1"}],"opportunity_ref":"opportunity:o1@1","rollback_ref":"bundle:attention-task@1","workflow_bridge_ref":"bridge:disputa-tarea@1"},"contract_version":"engine-steps/0","data_class":"synthetic","run_id":"run-cmp-0001","step":"compile"}