{"base_bundle_ref":"bundle:attention-task@1","change_spec":{"affected_routes":["disputa-tarea"],"base_bundle_ref":"bundle:attention-task@1","expected_mechanism":"clearer follow-up wording","operations":[{"new_ref":"prompt:resumen_radicado@2","op":"replace","precondition_digest":"sha256:727341c7f278859de2b2a8e997305012d9094e02ac60d4af7a722101fa9eb089","target_kind":"prompt","target_ref":"prompt:resumen_radicado@1"}],"opportunity_ref":"opportunity:sample-1@1","rollback_ref":"bundle:sample-0@1","workflow_bridge_ref":"bridge:disputa-tarea@1"},"contract_version":"engine-steps/0","data_class":"synthetic","run_id":"run-demo-0001","step":"compile"}