{
  "contract_version": "engine-steps/0",
  "step": "compile",
  "run_id": "run-demo-0001",
  "data_class": "synthetic",
  "base_bundle_ref": "bundle:sample-1@1",
  "change_spec": {
    "base_bundle_ref": "bundle:sample-1@1",
    "opportunity_ref": "opportunity:sample-1@1",
    "workflow_bridge_ref": "bridge:sample-1@1",
    "operations": [
      {
        "op": "replace",
        "target_kind": "prompt",
        "target_ref": "prompt:sample-1@1",
        "new_ref": "prompt:sample-2@1",
        "precondition_digest": "sha256:aaaaaaaaaaaaaaaaaaaaaaaaaaaaaaaaaaaaaaaaaaaaaaaaaaaaaaaaaaaaaaaa"
      }
    ],
    "expected_mechanism": "clearer follow-up wording",
    "affected_routes": [
      "pqr_status_lookup"
    ],
    "rollback_ref": "bundle:sample-0@1"
  }
}
